{
  "schema_version": 1,
  "task_id": "Task-0009",
  "status": "in_progress",
  "phase": "implementation",
  "plan_approved": true,
  "current_pass": "PASS-0000",
  "last_completed_pass": null,
  "current_gate": "implementation",
  "latest_audit_verdict": "unknown",
  "validation": {
    "build": "pending",
    "unit_tests": "pending",
    "regression": "pending"
  },
  "blockers": [],
  "next_expected_artifacts": [
    "PASS-0000 product-surface contract",
    "HANDOFF.md",
    "Testing/PASS-0000-AUDIT.md"
  ],
  "updated_at": "2026-04-26T21:31:54.7821121-04:00"
}
