{
  "schema_version": 1,
  "task_id": "Task-0006",
  "status": "cancelled",
  "phase": "closure",
  "plan_approved": false,
  "current_pass": null,
  "last_completed_pass": null,
  "current_gate": "none",
  "latest_audit_verdict": "unknown",
  "validation": {
    "build": "not_run",
    "unit_tests": "not_run",
    "regression": "not_run"
  },
  "blockers": [],
  "next_expected_artifacts": [],
  "updated_at": "2026-04-24T10:28:10.6599366-04:00"
}
