{
  "schema_version": 1,
  "task_id": "Task-0010",
  "status": "pending",
  "phase": "planning",
  "plan_approved": false,
  "current_pass": null,
  "last_completed_pass": null,
  "current_gate": "planning",
  "latest_audit_verdict": "unknown",
  "validation": {
    "build": "not_applicable",
    "unit_tests": "not_applicable",
    "regression": "not_applicable"
  },
  "blockers": [],
  "next_expected_artifacts": [],
  "updated_at": "2026-04-24T00:07:22.4834607-04:00"
}
