{
  "schema_version": 1,
  "task_id": "Task-0005",
  "status": "complete",
  "phase": "closure",
  "plan_approved": true,
  "current_pass": null,
  "last_completed_pass": "PASS-0004",
  "current_gate": "none",
  "latest_audit_verdict": "ready_with_caveats",
  "validation": {
    "build": "passing",
    "unit_tests": "passing",
    "regression": "passing"
  },
  "blockers": [],
  "next_expected_artifacts": [],
  "updated_at": "2026-04-07T12:42:35.1406027-04:00"
}
