{
  "schema_version": 1,
  "task_id": "Task-0004",
  "status": "in_progress",
  "phase": "regression",
  "plan_approved": true,
  "current_pass": "PASS-0002",
  "last_completed_pass": "PASS-0002",
  "current_gate": "regression",
  "latest_audit_verdict": "ready_with_caveats",
  "validation": {
    "build": "not_applicable",
    "unit_tests": "passing",
    "regression": "blocked"
  },
  "blockers": [
    "Final reopened closeout still needs live readback that the `Jobs` surface now scrolls correctly on the real overlay while preserving the declared-jobs contract."
  ],
  "next_expected_artifacts": [
    "Testing/PASS-0002-AUDIT.md",
    "HANDOFF.md"
  ],
  "updated_at": "2026-04-04T14:30:00-04:00"
}
