{
  "schema_version": 1,
  "task_id": "Task-0007",
  "status": "in_progress",
  "phase": "research",
  "plan_approved": false,
  "current_pass": null,
  "last_completed_pass": null,
  "current_gate": "research",
  "latest_audit_verdict": "unknown",
  "validation": {
    "build": "not_applicable",
    "unit_tests": "not_applicable",
    "regression": "not_applicable"
  },
  "blockers": [],
  "next_expected_artifacts": [],
  "updated_at": "2026-04-19T13:50:22.2507369-04:00"
}
